[
  {
    "id": "1990-07-09-kohl",
    "date": "1990-07-09",
    "type": "Memcon",
    "title": "Bilateral Meeting with German Chancellor Helmut Kohl",
    "participants": ["George H. W. Bush", "Helmut Kohl"],
    "countries": ["United States", "Germany"],
    "chapter": {
      "number": 4,
      "name": "Regional"
    },
    "sortDate": "1990-07-09",
    "releaseStatus": "Full",
    "naid": "428080825",
    "pdfUrl": "https://s3.us-east-1.amazonaws.com/NARAprodstorage/lz/presidential-libraries/bush/gb-nsc/321498039/1990-07-09--Kohl.pdf",
    "catalogUrl": "https://catalog.archives.gov/id/428080825",
    "source": {
      "name": "FOIA 2000-0429-F finding aid",
      "url": "https://www.bush41library.gov/digital-research-room/finding-aid/foia/records-memcons-and-telcons-january-1989-december-1991",
      "foiaNumber": "2000-0429-F"
    },
    "frusVolume": {
      "id": "frus1989-92v08",
      "title": "Foreign Relations of the United States, 1989-1992, Volume VIII, Western Europe",
      "url": "https://history.state.gov/historicaldocuments/frus1989-92v08",
      "status": "Being Researched"
    },
    "frusTopics": ["German unification", "NATO", "Western Europe"],
    "topics": ["German unification", "NATO", "Bilateral diplomacy"]
  },
  {
    "id": "1990-07-09-mitterrand",
    "date": "1990-07-09",
    "type": "Memcon",
    "title": "Meeting with President Mitterrand of France",
    "participants": ["George H. W. Bush", "Francois Mitterrand"],
    "countries": ["United States", "France"],
    "chapter": {
      "number": 2,
      "name": "France"
    },
    "sortDate": "1990-07-09",
    "releaseStatus": "Full",
    "naid": "428080827",
    "pdfUrl": "https://s3.us-east-1.amazonaws.com/NARAprodstorage/lz/presidential-libraries/bush/gb-nsc/321498039/1990-07-09--Mitterrand-1.pdf",
    "catalogUrl": "https://catalog.archives.gov/id/428080827",
    "source": {
      "name": "FOIA 2000-0429-F finding aid",
      "url": "https://www.bush41library.gov/digital-research-room/finding-aid/foia/records-memcons-and-telcons-january-1989-december-1991",
      "foiaNumber": "2000-0429-F"
    },
    "frusVolume": {
      "id": "frus1989-92v08",
      "title": "Foreign Relations of the United States, 1989-1992, Volume VIII, Western Europe",
      "url": "https://history.state.gov/historicaldocuments/frus1989-92v08",
      "status": "Being Researched"
    },
    "frusTopics": ["German unification", "European security", "Western Europe"],
    "topics": ["German unification", "European security", "Bilateral diplomacy"]
  },
  {
    "id": "1990-06-11-de-maiziere",
    "date": "1990-06-11",
    "type": "Memcon",
    "title": "Meeting with Prime Minister Lothar de Maiziere of the German Democratic Republic",
    "participants": ["George H. W. Bush", "Lothar de Maiziere"],
    "countries": ["United States", "German Democratic Republic"],
    "chapter": {
      "number": 4,
      "name": "Regional"
    },
    "sortDate": "1990-06-11",
    "releaseStatus": "Full",
    "naid": "428080745",
    "pdfUrl": "https://s3.us-east-1.amazonaws.com/NARAprodstorage/lz/presidential-libraries/bush/gb-nsc/321498039/1990-06-11--de-Maiziere-1.pdf",
    "catalogUrl": "https://catalog.archives.gov/id/428080745",
    "source": {
      "name": "FOIA 2000-0429-F finding aid",
      "url": "https://www.bush41library.gov/digital-research-room/finding-aid/foia/records-memcons-and-telcons-january-1989-december-1991",
      "foiaNumber": "2000-0429-F"
    },
    "frusVolume": {
      "id": "frus1989-92v08",
      "title": "Foreign Relations of the United States, 1989-1992, Volume VIII, Western Europe",
      "url": "https://history.state.gov/historicaldocuments/frus1989-92v08",
      "status": "Being Researched"
    },
    "frusTopics": ["German unification", "Eastern Europe", "Western Europe"],
    "topics": ["German unification", "Eastern Europe", "Bilateral diplomacy"]
  }
]
